speaker_id,movie_id,conversation_id,text,clean_text
u12,m1,L2179,"Can't be that far, I say.  Also, I don't like the smell of the sea around here.  Smells like a cunt. Bad sign...",
u12,m1,L2179,We should have seen land.,
u12,m1,L2176,He's the devil's child...,
u12,m1,L2173,With a face like that?  I don't want you looking at me.  You hear?,
u12,m1,L2173,"What are you listening to, chicken ass?",
u12,m1,L2170,You'll be drinking your own piss... For the glory of Spain... and Admiral Colon...!  Bastard!,
u12,m1,L2170,I never seen heat like this!  Not even in Las Minas!,
