speaker_id,movie_id,conversation_id,text,clean_text
u87,m5,L6313,It's an honor to receive you. Mr. President.,
u87,m5,L5585,An elephant couldn't crack it.,
u87,m5,L5573,"...This is the crucial phase, The reconstruction of pigment. Cells are bombarded with slightly greasy solar atoms which forces the body cells to react, to protect themselves. That means growing skin. Clever, eh?",
u87,m5,L5568,We put it through the cellular hygiene detector. The cell is for lack of a better word... perfect.,
u87,m5,L5568,"The compositional elements of his DNA chain are the same as ours, there are simply more of them tightly packed. His knowledge is probably limitless..",
u87,m5,L5560,Yes... I can't wait to meet him.,
u87,m5,L5560,This cell is like a huge library. It has infinite genetic knowledge stored inside. Almost like it was...engineered.,
u87,m5,L5560,"It's not that easy..we've never encountered anything like it before..you see normal human beings have 40 DNA memo groums..which is more than enough for any species to perpetuate itself..This one has 200,000.",
u87,m5,L5560,Actually only one cell survived..,
